{
  "boType": "DISCONNECTION_ORDER",
  "structureVersion": "1",
  "meetingPoint": {
    "postalCode": "64677",
    "city": "Neu Kira",
    "street": "Regensburger Str.",
    "houseNumber": "3",
    "poBox": "qui exercitation laboris",
    "addressSupplement": "sunt ex",
    "coSupplement": "ipsum cillum sed",
    "countryCode": "VU",
    "district": "Wilhelmshaven",
    "additionalInformation": {
      "supplement1": "voluptate incididunt pariatur non do",
      "supplement2": "sunt dolore",
      "supplement3": "deserunt sed",
      "supplement4": "sed nisi",
      "supplement5": "ut nulla veniam"
    }
  },
  "disconnectionOrderType": "UNLOCK",
  "disconnectionOrderStatus": "AGREED",
  "disconnectionOrderRejectionReason": "OTHER_ERROR",
  "disconnectionPreventionReason": "TECHNICAL_PREVENTION_REASON",
  "meterNumber": "ZAEHLER_111011",
  "isOrderedByBailiff": false
}